{
  "id": "china-rail",
  "projectId": "china-rail",
  "updatedAt": "2026-09-03",
  "sourceCommit": "d4ac43f60067cdbadc1e891940242a249a2e53f5",
  "i18n": {
    "en": {
      "title": "Set up China Rail MCP",
      "intro": "A beginner-friendly path from choosing a client to proving that a real railway query works. You do not need a 12306 account or programming experience.",
      "startTitle": "Start with one decision",
      "startIntro": "Where do you want to use China Rail MCP? The answer determines how it connects.",
      "routes": [
        {
          "id": "local",
          "title": "On this computer",
          "summary": "Choose local stdio. Your AI client starts China Rail MCP on the same computer.",
          "bestFor": "The easiest and safest first setup. No public server, domain, or secret is required.",
          "needs": ["A desktop MCP client that supports local stdio", "Git", "Node.js 20 or later", "npm 10 or later"],
          "cost": "China Rail MCP itself is free. Your AI client or model provider may charge separately.",
          "steps": [
            "Choose a desktop client that supports local stdio. Qwen Code, TRAE, and Claude Desktop are common routes; check the client guide before installing anything.",
            "Copy the AI setup request below into a coding AI that can use your terminal and files.",
            "Allow it to install missing software, restart an app, or change settings only after it explains the action.",
            "Do not accept “the build passed” as completion. Ask for a real get_provider_status call and a real train search from the configured client."
          ],
          "prompt": "Install and configure China Rail MCP on this computer until I can make a real Chinese railway query from the AI client I currently use. Repository: https://github.com/TakeruF/china-rail-mcp\n\nPerform the work instead of only giving me a tutorial. First identify the operating system, AI/MCP client, and whether Git, Node.js, and npm are available. If the target client is unclear, ask only that question. Read the latest README and self-hosting guide. Explain and ask before installing software, using administrator access, restarting a GUI app, or changing security settings.\n\nClone the repository into a stable location without overwriting existing work. Run npm ci and npm run verify. Find the absolute paths to Node.js and dist/index.js, then add a local stdio server named china-rail using the configuration format actually supported by my client. Preserve all existing settings. Local mode needs no .env, 12306 account, cookie, or secret; never ask me for them.\n\nReload the client as required. Prove the setup from the configured client by calling get_provider_status, searching for 上海虹桥 with search_stations, and then searching for trains from 上海虹桥 to 杭州东 on a date inside the current sales window. Distinguish a working local connection from a temporary 12306 live-query failure. Finish by reporting the installation path, client configuration changed, verification result, actual MCP tool result, and one example question I can ask next. Do not commit or push repository changes.",
          "manualTitle": "Prefer to do it yourself?",
          "manualIntro": "Run these commands in a terminal. Then add the absolute dist/index.js path to your client's stdio MCP configuration.",
          "commands": ["git clone https://github.com/TakeruF/china-rail-mcp.git", "cd china-rail-mcp", "npm ci", "npm run verify"],
          "success": ["npm run verify passes", "The client lists China Rail MCP or its six tools", "get_provider_status returns through the client", "A current station or train query returns through the client"],
          "troubleshooting": ["A silent npm start is normal: an stdio server waits for the client over standard input/output.", "If the client cannot find Node.js, use the absolute path returned by command -v node.", "If only the live query fails, the MCP connection may still be correct; check provider status and the current 12306 availability separately."]
        },
        {
          "id": "remote",
          "title": "On a phone or across devices",
          "summary": "Choose a private remote deployment. Your AI client connects to China Rail MCP over HTTPS.",
          "bestFor": "Phone access or multiple devices. This route has more account, hosting, authentication, and possible cost requirements.",
          "needs": ["GitHub and Vercel accounts", "An AI client account that supports custom remote MCP", "A stable HTTPS deployment", "Private authentication and OAuth"],
          "cost": "China Rail MCP is free, but hosting, model usage, or the required client plan may cost money.",
          "steps": [
            "Check the client compatibility guide first. Consumer chat apps do not all accept arbitrary custom MCP servers.",
            "Copy the remote setup request below into a coding AI that can use both a browser and terminal.",
            "Approve account sign-in, cloud project creation, charges, and Production deployment only after their impact is explained.",
            "Verify deployment, account connection, and the phone tool call as three separate results."
          ],
          "prompt": "Deploy China Rail MCP as a private personal remote service and continue until I can make a real Chinese railway query from my phone's AI client. Repository: https://github.com/TakeruF/china-rail-mcp\n\nPerform the work instead of only giving me a tutorial. Read the latest README, self-hosting guide, and the current client's official remote-MCP documentation. Confirm that my GitHub, Vercel, and AI client accounts have the required features. Explain and ask before charges, cloud project creation, account sign-in, or Production deployment.\n\nClone the repository safely, run npm ci and npm run verify, and do not modify or push its source. Create a personal Vercel project. Generate a strong unique MCP_HTTP_BEARER_TOKEN and store it only as a masked Production environment variable. Never show it in source, .env, Git, chat, screenshots, logs, or the final report.\n\nDeploy the current main commit to Production and use its stable HTTPS hostname. Run npm run smoke:http -- https://ACTUAL_HOST/api. Confirm health and OAuth metadata return 200, and that unauthenticated /api/mcp returns the expected 401 with discovery information. This 401 proves authentication is active.\n\nConnect https://ACTUAL_HOST/api/mcp using the flow actually supported by my current client and complete OAuth. First call get_provider_status and search_stations on web or desktop. Then open a new conversation on the phone with the same account, enable the connection, and search for trains from 上海虹桥 to 杭州东 on a date inside the sales window. Report deployment success, account connection success, and mobile tool-call success separately. Never make the server public or remove authentication as a workaround. Finish by reporting only the project name, HTTPS MCP URL without secrets, deployment and tool-call results, possible cost points, and how to revoke access.",
          "manualTitle": "What the hosted setup must produce",
          "manualIntro": "The implementation repository contains the exact deployment and OAuth details. These are the milestones to check.",
          "commands": ["npm ci", "npm run verify", "npm run smoke:http -- https://YOUR_HOST/api", "Connect https://YOUR_HOST/api/mcp in the supported AI client"],
          "success": ["The Production deployment and unauthenticated smoke test pass", "OAuth completes and a web or desktop client can call a tool", "The same account can see the connection on the phone", "A real tool call succeeds from a new phone conversation"],
          "troubleshooting": ["An unauthenticated 401 from /api/mcp is expected when discovery information is present.", "A successful deployment does not prove that the account or phone app supports custom MCP.", "If mobile access is missing, check the client version, account plan, region, staged rollout, and workspace policy. Do not disable authentication."]
        }
      ],
      "safetyTitle": "Keep these boundaries",
      "safety": ["China Rail MCP is read-only. It does not log in, book, purchase, solve CAPTCHAs, or bypass restrictions.", "Local mode never needs a 12306 account, user cookie, API key, or .env file.", "Keep remote deployments private. Never paste the bearer secret into chat or publish it in a repository.", "Verify important travel information in an official 12306 channel because public upstream formats and availability can change."],
      "glossaryTitle": "Three terms in plain language",
      "glossary": [
        { "term": "MCP", "definition": "A standard that lets an AI client call tools supplied by another program." },
        { "term": "stdio", "definition": "A local connection: the desktop client starts the MCP program on the same computer." },
        { "term": "remote MCP", "definition": "A hosted HTTPS connection used by cloud clients and, when supported, phone apps." }
      ]
    },
    "zh": {
      "title": "配置 China Rail MCP",
      "intro": "面向新手的完整路径：先选择客户端，再完成连接，并用一次真实铁路查询确认可用。不需要 12306 账号，也不要求编程经验。",
      "startTitle": "先做一个选择",
      "startIntro": "你想在哪里使用 China Rail MCP？这决定了连接方式。",
      "routes": [
        {
          "id": "local",
          "title": "在这台电脑上使用",
          "summary": "选择本地 stdio。AI 客户端会在同一台电脑上启动 China Rail MCP。",
          "bestFor": "这是最简单、最安全的首次配置方式，不需要公网服务器、域名或密钥。",
          "needs": ["支持本地 stdio 的桌面 MCP 客户端", "Git", "Node.js 20 或更高版本", "npm 10 或更高版本"],
          "cost": "China Rail MCP 本身免费；AI 客户端或模型提供商可能另外收费。",
          "steps": [
            "选择支持本地 stdio 的桌面客户端。Qwen Code、TRAE 和 Claude Desktop 都是常见方案；安装前先看客户端指南。",
            "把下面的 AI 配置请求完整复制给能够操作终端和文件的编程 AI。",
            "安装缺失软件、重启应用或修改设置时，只在 AI 说明影响后再允许。",
            "不要把“构建通过”当成完成；必须从已配置客户端实际调用 get_provider_status 并查询车次。"
          ],